{
  "schema_version": "cyrano.assessment-evidence/3",
  "suite_digest": "sha256:0000000000000000000000000000000000000000000000000000000000000000",
  "source_digest": "sha256:0000000000000000000000000000000000000000000000000000000000000000",
  "policy_digest": "sha256:0000000000000000000000000000000000000000000000000000000000000000",
  "runtime_digest": "sha256:0000000000000000000000000000000000000000000000000000000000000000",
  "scope": "CYRANO_owned_delta_and_generated_python_workloads",
  "records": [],
  "template_not_execution": true
}
